{
  "contractVersion": "sceneMeaningV1",
  "catalogueVersion": "meaning-bank-1.0.0",
  "geometryVersion": "svg-shapes-v1",
  "contactPolicy": "noncontact-v1",
  "records": [
    {
      "meaningId": "TM01.meaning.1",
      "sceneId": "TM01",
      "revision": 1,
      "title": "Awkward passing",
      "target": "Two travelers moving in opposite directions repeatedly choose the same passing side and accidentally get in each other’s way.",
      "cast": [
        {
          "actorId": "a",
          "shape": "circle",
          "color": "violet",
          "role": "left_to_right_traveler"
        },
        {
          "actorId": "b",
          "shape": "square",
          "color": "amber",
          "role": "right_to_left_traveler"
        }
      ],
      "coreEvent": [
        {
          "id": "E1",
          "assertion": "The actors begin with opposing destinationward travel along a shared corridor-like region, without a rendered corridor prop."
        },
        {
          "id": "E2",
          "assertion": "Both actors adjust their own routes in an effort to pass; repeated same-side choices interrupt progress."
        },
        {
          "id": "E3",
          "assertion": "Obstruction is mutual coordination failure, not one actor repeatedly intercepting an otherwise passive traveler."
        }
      ],
      "roleBindings": [
        {
          "role": "left_to_right_traveler",
          "actorIds": [
            "a"
          ]
        },
        {
          "role": "right_to_left_traveler",
          "actorIds": [
            "b"
          ]
        },
        {
          "role": "mutual_adjusters",
          "actorIds": [
            "a",
            "b"
          ]
        }
      ],
      "allowedElaborations": [
        "Vary pause lengths, which traveler initiates each adjustment, path heights and travel distance within the numeric limits.",
        "Show a final successful opposite-side pass only after at least two mutual same-side conflicts have established the event.",
        "Hold an unresolved encounter after the repeated conflicts.",
        "Make braking and intended opposing travel more visible without adding symbols or scenery."
      ],
      "contradictions": [
        {
          "id": "C1",
          "assertion": "One actor is the persistent deliberate blocker while the other never independently changes its route."
        },
        {
          "id": "C2",
          "assertion": "Both actors travel toward a shared destination or one pursues the other."
        },
        {
          "id": "C3",
          "assertion": "Only simultaneous rhythmic ornament remains, with no opposing travel or failed passing."
        },
        {
          "id": "C4",
          "assertion": "Actors touch, overlap or pass through each other."
        }
      ],
      "targetRubric": {
        "version": "TM01.interpretation.1",
        "complete": "The guess describes two people/shapes mutually trying to pass or repeatedly getting in each other’s way while adjusting. No exact phrase, motive or scene setting is required.",
        "partial": "The guess identifies mutual obstruction, attempted passing or coordination trouble but omits the relation that distinguishes it from a single blocker.",
        "offTarget": "The guess asserts only dancing, pursuit, fighting, or one intentional blocker, with no compatible mutual-passing relation; unrelated/no-interpretation answers are also off target.",
        "acceptedParaphrases": [
          "They both keep choosing the same way around.",
          "Trying to get past each other.",
          "An awkward sidewalk shuffle."
        ],
        "likelyConfusions": [
          "They are dancing.",
          "One is deliberately blocking the other."
        ]
      },
      "fidelityAssessment": {
        "version": "TM01.fidelity.1",
        "method": "independent_human_review",
        "labels": {
          "target_preserved": "The complete visible choreography supports the core event and its role bindings, with no observed contradiction. Timing or staging changes within allowed elaborations are acceptable.",
          "unclear": "A complete playable act is available, but its visible motion does not support a confident target-preserved or changed-story decision. Ambiguity or unreadable meaning must not be called fidelity.",
          "changed_story": "The visible choreography establishes at least one listed contradiction or a materially incompatible event or role relation. Record that relation and its timestamp.",
          "unrateable": "The act cannot be assessed because the score or required playback is missing, corrupted, inaccessible or incomplete. Record the concrete reason; do not invent a semantic judgment."
        },
        "requiredEvidence": [
          "Meaning ID and exact score hash",
          "Reviewer ID and rubric version",
          "Observable support or missing support for each E assertion, with timestamps",
          "Observed C contradiction IDs or explicit none-observed",
          "Role-binding consistency",
          "Presentation mode and whether the complete act was viewable",
          "Outcome stored separately; never written back into this immutable record"
        ]
      },
      "contentStatus": "development_scripted",
      "geometryVersion": "svg-shapes-v1",
      "contactPolicy": "noncontact-v1"
    },
    {
      "meaningId": "TM09.meaning.1",
      "sceneId": "TM09",
      "revision": 1,
      "title": "Delayed copying",
      "target": "One actor copies another actor’s distinct local movements after a visible delay.",
      "cast": [
        {
          "actorId": "a",
          "shape": "square",
          "color": "violet",
          "role": "initiator"
        },
        {
          "actorId": "b",
          "shape": "triangle",
          "color": "amber",
          "role": "copier"
        }
      ],
      "coreEvent": [
        {
          "id": "E1",
          "assertion": "Actor a initiates at least three distinguishable local motion changes before b."
        },
        {
          "id": "E2",
          "assertion": "Actor b reproduces the order and relative directions of a’s movements after a visible positive lag."
        },
        {
          "id": "E3",
          "assertion": "Both remain in separate local areas; b does not pursue a or try to occupy a’s place."
        }
      ],
      "roleBindings": [
        {
          "role": "initiator",
          "actorIds": [
            "a"
          ]
        },
        {
          "role": "copier",
          "actorIds": [
            "b"
          ]
        }
      ],
      "allowedElaborations": [
        "Vary the visible positive lag and irregular pauses while preserving who initiates and the copied sequence.",
        "Use position changes as the main cues; restrained rotation or squash may supplement them.",
        "Keep distinct noncontact anchor zones and vary the path’s shape within each zone.",
        "End with the copier finishing after the initiator has settled."
      ],
      "contradictions": [
        {
          "id": "C1",
          "assertion": "b initiates the sequence and a copies it."
        },
        {
          "id": "C2",
          "assertion": "Both start every motion simultaneously with no discernible leader/lag relation."
        },
        {
          "id": "C3",
          "assertion": "The movements are independent sequences rather than ordered imitation."
        },
        {
          "id": "C4",
          "assertion": "b follows a through the same global route or approaches a as a pursuer."
        }
      ],
      "targetRubric": {
        "version": "TM09.interpretation.1",
        "complete": "The guess identifies one actor copying, mimicking or repeating the other after it acts; explicit numerical delay is unnecessary.",
        "partial": "The guess notices similar repeated moves or a follow-the-leader relation without making the imitation/order clear.",
        "offTarget": "The guess describes only synchronized dance, independent exercise, pursuit or role-reversed imitation, without a compatible copying relation.",
        "acceptedParaphrases": [
          "One is copying the other.",
          "The second shape keeps mimicking the first.",
          "Follow the leader, a beat late."
        ],
        "likelyConfusions": [
          "They are dancing in sync.",
          "One is chasing the other."
        ]
      },
      "fidelityAssessment": {
        "version": "TM09.fidelity.1",
        "method": "independent_human_review",
        "labels": {
          "target_preserved": "The complete visible choreography supports the core event and its role bindings, with no observed contradiction. Timing or staging changes within allowed elaborations are acceptable.",
          "unclear": "A complete playable act is available, but its visible motion does not support a confident target-preserved or changed-story decision. Ambiguity or unreadable meaning must not be called fidelity.",
          "changed_story": "The visible choreography establishes at least one listed contradiction or a materially incompatible event or role relation. Record that relation and its timestamp.",
          "unrateable": "The act cannot be assessed because the score or required playback is missing, corrupted, inaccessible or incomplete. Record the concrete reason; do not invent a semantic judgment."
        },
        "requiredEvidence": [
          "Meaning ID and exact score hash",
          "Reviewer ID and rubric version",
          "Observable support or missing support for each E assertion, with timestamps",
          "Observed C contradiction IDs or explicit none-observed",
          "Role-binding consistency",
          "Presentation mode and whether the complete act was viewable",
          "Outcome stored separately; never written back into this immutable record"
        ]
      },
      "contentStatus": "development_scripted",